{
  "format": "hanko.theme-catalog/v1",
  "version": "0.1.1",
  "status": "draft",
  "themes": [
    {
      "id": "evidence",
      "version": "0.1.1",
      "name": "Évidence",
      "description": "A bright, spacious interface with plain language and one clear decision at each step. Everyday account tasks feel familiar and easy to find.",
      "license": "Apache-2.0",
      "tags": [
        "essential",
        "Services",
        "Consumer products",
        "Institutions"
      ],
      "style": {
        "id": "evidence",
        "name": "Évidence",
        "description": "A bright, spacious interface with plain language and one clear decision at each step. Everyday account tasks feel familiar and easy to find.",
        "accent": "#245dda",
        "background": "#f5f7fb",
        "surface": "#ffffff",
        "foreground": "#1c283b",
        "muted": "#58677d",
        "radius": 12,
        "layout": "left",
        "font": "\"Hanko Sans\", sans-serif",
        "headingFont": "\"Hanko Sans\", sans-serif",
        "density": "comfortable",
        "composition": "evidence",
        "fieldStyle": "outline",
        "actionSize": "full"
      },
      "themePath": "themes/evidence/theme.json",
      "templates": [
        {
          "id": "login",
          "name": "Sign in",
          "surface": "keycloak-login",
          "editorPage": "login:0",
          "path": "themes/evidence/pages/login.json",
          "targets": [
            "project-json",
            "native-appearance",
            "native-composition"
          ]
        },
        {
          "id": "register",
          "name": "Registration",
          "surface": "keycloak-login",
          "editorPage": "login:1",
          "path": "themes/evidence/pages/register.json",
          "targets": [
            "project-json",
            "native-appearance",
            "native-composition"
          ]
        },
        {
          "id": "otp",
          "name": "Verification code",
          "surface": "keycloak-login",
          "editorPage": "login:2",
          "path": "themes/evidence/pages/otp.json",
          "targets": [
            "project-json",
            "native-appearance",
            "native-composition"
          ]
        },
        {
          "id": "email-verification",
          "name": "Verify email",
          "surface": "keycloak-email",
          "editorPage": "email:0",
          "path": "themes/evidence/pages/email-verification.json",
          "targets": [
            "project-json",
            "native-composition"
          ]
        },
        {
          "id": "email-password-reset",
          "name": "Email Password Reset",
          "surface": "keycloak-email",
          "editorPage": "email:1",
          "path": "themes/evidence/pages/email-password-reset.json",
          "targets": [
            "project-json",
            "native-composition"
          ]
        },
        {
          "id": "email-required-actions",
          "name": "Email Required Actions",
          "surface": "keycloak-email",
          "editorPage": "email:2",
          "path": "themes/evidence/pages/email-required-actions.json",
          "targets": [
            "project-json",
            "native-composition"
          ]
        },
        {
          "id": "account-profile",
          "name": "Profile",
          "surface": "keycloak-account",
          "editorPage": "account:0",
          "path": "themes/evidence/pages/account-profile.json",
          "targets": [
            "project-json",
            "react-next"
          ]
        },
        {
          "id": "account-security",
          "name": "Security",
          "surface": "keycloak-account",
          "editorPage": "account:1",
          "path": "themes/evidence/pages/account-security.json",
          "targets": [
            "project-json",
            "react-next"
          ]
        },
        {
          "id": "account-password",
          "name": "Password",
          "surface": "keycloak-account",
          "editorPage": "account:2",
          "path": "themes/evidence/pages/account-password.json",
          "targets": [
            "project-json",
            "react-next"
          ]
        },
        {
          "id": "account-mfa",
          "name": "Account Mfa",
          "surface": "keycloak-account",
          "editorPage": "account:3",
          "path": "themes/evidence/pages/account-mfa.json",
          "targets": [
            "project-json",
            "react-next"
          ]
        },
        {
          "id": "account-sessions",
          "name": "Sessions",
          "surface": "keycloak-account",
          "editorPage": "account:4",
          "path": "themes/evidence/pages/account-sessions.json",
          "targets": [
            "project-json",
            "react-next"
          ]
        },
        {
          "id": "admin-console",
          "name": "Administration",
          "surface": "keycloak-admin",
          "editorPage": "admin:0",
          "path": "themes/evidence/pages/admin-console.json",
          "targets": [
            "project-json"
          ]
        },
        {
          "id": "admin-users",
          "name": "Users",
          "surface": "keycloak-admin",
          "editorPage": "admin:1",
          "path": "themes/evidence/pages/admin-users.json",
          "targets": [
            "project-json"
          ]
        },
        {
          "id": "admin-user",
          "name": "User details",
          "surface": "keycloak-admin",
          "editorPage": "admin:2",
          "path": "themes/evidence/pages/admin-user.json",
          "targets": [
            "project-json"
          ]
        },
        {
          "id": "admin-clients",
          "name": "Applications",
          "surface": "keycloak-admin",
          "editorPage": "admin:3",
          "path": "themes/evidence/pages/admin-clients.json",
          "targets": [
            "project-json"
          ]
        },
        {
          "id": "admin-client",
          "name": "Application details",
          "surface": "keycloak-admin",
          "editorPage": "admin:4",
          "path": "themes/evidence/pages/admin-client.json",
          "targets": [
            "project-json"
          ]
        },
        {
          "id": "admin-permissions",
          "name": "Permissions",
          "surface": "keycloak-admin",
          "editorPage": "admin:5",
          "path": "themes/evidence/pages/admin-permissions.json",
          "targets": [
            "project-json"
          ]
        },
        {
          "id": "welcome",
          "name": "Welcome",
          "surface": "keycloak-welcome",
          "editorPage": "welcome:0",
          "path": "themes/evidence/pages/welcome.json",
          "targets": [
            "project-json"
          ]
        }
      ],
      "locales": [
        "fr",
        "en",
        "es",
        "de",
        "it",
        "pt-BR",
        "ar",
        "he"
      ],
      "complete": true,
      "assets": [],
      "design": {
        "number": "01",
        "family": "essential",
        "title": "Clarity comes naturally.",
        "audience": "Services · Consumer products · Institutions",
        "details": [
          "A focused sign-in flow with room to breathe.",
          "Horizontal account navigation and settings grouped around everyday tasks.",
          "Confident blue accents, generous spacing and understated sans-serif typography.",
          "A consistent identity across all 18 screens, including editorial cues, navigation, service panels and emails."
        ],
        "sources": [
          {
            "label": "Google — sign-in",
            "url": "https://accounts.google.com/"
          },
          {
            "label": "Apple — official website",
            "url": "https://www.apple.com/"
          }
        ],
        "introduced": false
      }
    },
    {
      "id": "precision",
      "version": "0.1.1",
      "name": "Précision",
      "description": "A considered product interface with a precise grid, measured contrast and compact controls. Clear hierarchy keeps complex account settings manageable.",
      "license": "Apache-2.0",
      "tags": [
        "product",
        "SaaS",
        "Teams",
        "Professional tools"
      ],
      "style": {
        "id": "precision",
        "name": "Précision",
        "description": "A considered product interface with a precise grid, measured contrast and compact controls. Clear hierarchy keeps complex account settings manageable.",
        "accent": "#b5b5f9",
        "background": "#17181c",
        "surface": "#1f2026",
        "foreground": "#ededf1",
        "muted": "#a7a7b3",
        "radius": 6,
        "layout": "left",
        "font": "\"Hanko Sans\", sans-serif",
        "headingFont": "\"Hanko Sans\", sans-serif",
        "density": "comfortable",
        "composition": "precision",
        "fieldStyle": "outline",
        "actionSize": "full"
      },
      "themePath": "themes/precision/theme.json",
      "templates": [
        {
          "id": "login",
          "name": "Sign in",
          "surface": "keycloak-login",
          "editorPage": "login:0",
          "path": "themes/precision/pages/login.json",
          "targets": [
            "project-json",
            "native-appearance",
            "native-composition"
          ]
        },
        {
          "id": "register",
          "name": "Registration",
          "surface": "keycloak-login",
          "editorPage": "login:1",
          "path": "themes/precision/pages/register.json",
          "targets": [
            "project-json",
            "native-appearance",
            "native-composition"
          ]
        },
        {
          "id": "otp",
          "name": "Verification code",
          "surface": "keycloak-login",
          "editorPage": "login:2",
          "path": "themes/precision/pages/otp.json",
          "targets": [